,subreddit,selftext,title
542,tea,"I got my second shipment of Bird &amp; Blend teas this week and have been quite amazingly impressed with every flavour.In my first shipment I liked the teas, but none of them really wowed me. Peach Cobbler was too subtly flavoured/not very peachy, Cherry Bakewell was a bit tangy cherry, not much else, Dark Choc Chilli Chai was okay but didn't blow me away, Totally Nutty was quite good, but Bonfire Toffee (which I think is a great tea) just didn't somehow suit my tastebuds.This time I got the following four teas:* **Creme Egg Tea** - *Sri Lankan black tea, cocoa nibs, cocoa shells, jasmine blossom, sunflower petals, natural flavouring* - a really incredible tea that tastes like chocolate custard but is not remotely ""sickly"" or artificial, as many chocolate-flavoured teas can be. The jasmine is very subtle, I couldn't markedly detect it, but I feel it gives a slight floral hint/lift. As an experiment I brewed a cup adding a tiny bit of jasmine tea, and the extra jasmine actually didn't work, so I think they've got the balance perfect.* **Birthday Cake** - *Rooibos (84%), Sri Lankan Black Tea, Sprinkles, Almond Pieces, Vanilla Pieces, Mallow Flowers, natural flavouring* - I'm not a huge fan of rooibos generally, but the almond in this really brings it together and it's an exceptionally smooth cup and much like Yorkshire Biscuit Tea, is somehow ""savoury"" rather than sweet.* **The Big Smoke** - *Chinese pu'er tea, ginger, lemongrass, lapsang souchong black tea, red peppercorns* - honestly one of the most fascinating and drinkable flavoured teas I've had. It's like a savoury smoky lemon chai. I will almost certainly be ordering this one again, as well as looking for similar blends.* **Coconut Milk Oolong** - *Taiwanese milk oolong, coconut flakes, desiccated coconut* - this one is supposed to be brewed at 80c and the first time I made it I brewed it too hot, not letting the boiled water cool enough. This made it taste like bitter green tea not even an oolong. The second time I put some cold water in the cup first and the transformation was amazing. It's so smooth. I even managed to drink a cup of it without milk and didn't hugely struggle as I usually do with black/non-milk-added tea. The only thing I wonder about is whether the coconut could be a bit stronger? So I'm going to try adding some extra coconut to a future cup to see what that does.","Review of four Bird &amp; Blend teas: Creme Egg, Birthday Cake, The Big Smoke, Coconut Milk Oolong"
544,tea,"I had to do a procedure for 2 months in February and March that required me to give up all caffeine. Now it seems I can't handle it at all anymore. I had a matcha latte a week ago and my resting heart rate went above 120. Tea was a big part of my life and I just had to give away a lot of my teas which was hard. Before I drank a lot of David's Teas, especially their flavored black teas, but I don't really like a lot of their rooibos teas. I have found replacements in some Republic of Tea rooibos teas, but would love more recommendations. Also if anyone knows of a good decaf Matcha tea, I would be forever grateful!",Best Decaf Teas?
545,tea,,Close-up of Taiping Houkui from this morning’s brew
546,tea,,is this an adequate teapot for sencha?I have a Kyushu but it's 350mls. currently in the process of getting something smaller. the teapot in the picture is 120ml and would be a better first for solo sessions
547,tea,"I just watched the first episode of True Believers (S1:E1 Empire of Yoga), a Vice series on cults, on HULU. The episode talked about Yogi Bhajan (Harbhajan Singh Khalsa) who came from India in the 60s and set up a big cult called [3HO]( Yogi Tea is one of the corporate entities of 3HO.Yogi Bhajan encouraged his followers to move in together and form Ashrams. They were encouraged to buy houses and put them in the cult’s name. They were encouraged to work for the cult and to send their children to boarding schools 3HO set up in India. Some of the women have come out and said that they were sexually abused by Yogi Bhajan (he died in 2004, and his family now owns Yogi Tea and continues the cult). The children at the boarding schools were beaten regularly and went through a lot at the schools. While the Yogi’s family got rich, a lot of the supporters were very poor, living in squalor, and working for the cult.I just thought Yogi tea was just one of the multiple regular tea companies on the market. I had no idea it had such a dark origin story.I thought others would like to know and watch the episode for themselves. I have no problem with Yogis and SE Asian religions, but I do have a problem with organizations who take advantage of women and children. I thought others would like to know where their money is going. The people who head 3HO now deny any wrongdoing by Yogi Bhajan (even though he had multiple young wives brought up in the cult). There’s so many other brands out there, and it’s cool that there’s so many small independent companies we can patronize. Yogi Tea makes billions a year.",Disturbing info about Yogi Tea being owned by a cult
548,tea,,"got to class too early today, luckily has a spare teapot on the car"
549,tea,,Gray epoxy kintsugi gaiwan
550,tea,,"Gyokuro Karigane, third steep"
551,tea,,"My first tea ""set"" that I put together from thrift stores and online!"
552,tea,,My mother came back from Ireland and brought Irish tea as a souvenir for me :)
553,tea,How do I know If a source is safe regarding pesticide use and heavy metals?,thoughts on the heath and heather brand tea?
554,tea,"Me and my gf really love tea (japanese tea in particular) and we are just now getting into it more, so I decided I wanted a new teapot (my gf has a cast iron one that she got in JP, but is quite oxidated). Was considering a ceramic Kyusu with a fine mesh cuz I know ceramic ones tend to absorb the flavor, but I want to try different teas as well. Also whats the best size for 2/3 people? I dont wanna get it neighter to smal or to big. Any online store recomendation would be apreciated as well :)",Teapot recommendation
555,tea,,"Homemade blend tea: white tea, rose, tangerine peel and wolfberry"
556,tea,,"The day has come, my gaiwan broke :/ any tips which foodsave glue to use?"
557,tea,,Tea &amp; biscuit
558,tea,,"This is some of the best milk tea I’ve had. From Din Tai Fung in University District, Seattle."
559,tea,Thanks in advance for any recommendations! I’m looking to buy a variable temperature kettle. Stuck between getting a mid-range one now or waiting for these $100+ kettles to hopefully go on sale in a couple of months for prime day. Thoughts?,Variable Temperature Kettles
561,tea,,Can anyone help me identify this?
562,tea,,Please help me identify this
563,tea,"I see no reason why this wouldn't work but maybe I'm missing something. Here's the idea: I want to make my own Irish breakfast blend. I figured I'd use [this]( CTC Assam for maltiness and strength, and [this]( Ceylon for some added brightness. Hopefully this would result in a pretty strong and cost-effective blend. Has anyone here tried blending CTC and orthodox teas together? Did it work? Or does the difference in leaf size mess up the blend in some way? I just figured I'd ask before I commit to buying 3lb of tea!",Has anyone here blended CTC and orthodox black teas?
564,tea,"im looking for a website to buy high quality loose leaf tea, but it seems like that have 2+ week shipping times, does anyone know where i can get tea in under 2 weeks?",where to buy tea
565,tea,,Grandpaing the oolong
566,tea,,the loyd rooibos tea
567,tea,,Ice brewed tea
569,tea,,"New Japanese tea set from a fellow Italian tea shop (one of the few good ones we have here). Cannot wait to brew tea in these, i had to share them 🥹"
570,tea,,Jasmine Pearls in the morning
571,tea,,"Green tea fields of Shimada, Shizuoka"
573,tea,,Black tea foam
575,tea,,Having my favorite tisane for the first time in months after a long battle with Hyperemesis Gravidarum
576,tea,,2022 Organic Bai Ya Bao
577,tea,,Russian Caravan Tea
579,tea,,My sister-in-law gifted me a couple of boxes of Japanese tea that resemble a pack of cigarettes — even down to the packets inside.
580,tea,,Chai Latte with Taj Mahal black tea
582,tea,,hand forged tea knife/pick
585,tea,,Can you drink chamomile tea with antihistamine?
586,tea,"I wrote about storage conditions inputs changing sheng aging process recently, and this review post is another example of that, about two 2007 sheng pu'er versions that turned out quite differently, in part related to one aging slower than the other.  Surely lower humidity input was the main cause, but I only saw storage location mentioned for one version.[&amp;#x200B;",Reviewing two 2007 sheng pu'er versions
589,tea,,"A bit of chemistry, anyone? Harney and Sons Indigo Punch with a dash (okay, a lot) of lemon juice."
590,tea,,Some midnight tea
592,tea,,Using Notion to track teas.
593,tea,,Suutei Tsai - Mongolian salted milk tea
594,tea,"Hi, I wanted to do a quick survey about tea and the price of loose leaf teas. Thank you to anybody that responds! Explanations as to why you chose what you did in the comments would also help a ton.[View Poll](",Loose leaf tea tasting sets
597,tea,I want to solve the problem of not having a cup of chai at night. I'm looking for a brand that I can order an absurd amount from so I can remove the concern from my mind for as long as chai stays tasty. I looked online and only found a few dubious listicles. Any recommendations?Similar concern for normally caffinated breakfast tea,Best place to order 5 pounds of decaf chai?
600,tea,,Aged heicha! 2015 Anhua Tianjian from White2tea
601,tea,,Best place to buy Pu er tea cakes?
602,tea,,Best places to buy Pu er tea cakes?
603,tea,I'd like to get some more tea and tea accessories made in Ukraine. I have two enamelled steel mugs by the brand Novomoskovsjka Posuda and I've been looking at their kettles. I was wondering if anyone knows of other Ukrainian brands for these things or tea in general or other accessories. I've thought of posting in the Ukraine specific subreddits but I thought I'd try here first.,Ukrainian tea brands and accessories?
604,tea,My former favourite tea shop was based in UK (what-cha) but since Brexit i would have to pay import taxes on my orders. Do you guys have any recommendations? I would like a website that is similar to what cha with google maps references to the tea estates and transperency is important to me.,Best online tea shops in European union?
605,tea,,Which button for fruit tea?
606,tea,"I usually make some fruit tea before going to sleep so i have cold tea to take to work, since it's bloody hot in the offices and i like tea.But today while listening to the radio i heard that leaving tea out for more than 8h causes the tea to go bad, so is it a myth or fact?",Can i leave tea out overnight?
607,tea,"I was trying to learn about oolong and the article says it’s between green and black, it just depends on how long the oxidation process is. So are all these teas actually the leaves from the same plant?",Noob question. Are green and black teas from the same plant?
608,tea,,Wulong Wednesday? Currently enjoying some Tieguanyin with some Amphora full aroma.
610,tea,,Tea at the park!
611,tea,"I need some help from any tea gurus out there!So when I make a cup of tea with a tea bag that recommends 8oz of water, does it affect the taste if I pour my boiling water into a measuring cup and then pour it into my cup with the tea bag in it. I read somewhere that water cools down each time you pour it, so this might effect the flavor. If so, should I just practice eyeballing my water amount so I’m pouring directly into the cup with the tea bag? (My electric kettle has a minimum water level of 0.5 liters.)Any advice appreciated!",Measuring Water Volume
612,tea,"I go through a ***lot*** of dragon pearl jasmine so I buy that one in bulk. And I have been drinking a lot of ""Himalayan Peach"" by Mariage Freres which is a peach darjeeling and finally bought a 500 gram bag of it. I almost always drink my tea iced (no sweetener) and make a liter of it the night before using a modified method that's more like gong-fu than western style brewing, though it's not technically either. The one hot drink I enjoy regularly is peppermint herbal, so I buy that one by the pound too. What teas do you drink enough of to to buy in bulk?",Which teas you drink enough of to buy in bulk?
613,tea,,Three grades of white tea
614,tea,"Hi gang, Id really like to find a good gong Fu tea set for my wife's birthday but the only sites that has really popped up is umi tea sets and Etsy, both which seem less than ideal.Just wondering if anyone can point me in a direction to a good importer for a good full tea set and tray.TIA",Looking for a nice gongfu tea set uk
616,tea,i'm having to wean myself off of white tea (sensitive to caffeine) and rooibos/honeybush is a little staining. what are your favorite herbal teas that i could substitute for white tea?,Recommendations for light-colored tisanes?
617,tea,"Or any other tea that is super, super creamy even when drunk black?I really struggle with drinking milk-less tea (unless it's a chai sweetened with honey) but on fasting days I can only have black tea.Thanks for any suggestions!",What's the milkiest of milky Milk Oolongs you have tried?
618,tea,,green tea field in Boseong
619,tea,"As a beginner to tea I remember thinking that Oolong tea contains the secret ingredient - Oolong. :DI never bothered to check, and only after I started taking tea more seriously I asked - so how does that oolong the secret ingredient look like?..",What questions did you have about tea that now seem ridiculous?
620,tea,,Lu Shan Yun Wu from this afternoon
621,tea,,I just bought this set at an estate sale for $12. Does anyone know anything about it?
622,tea,"Because of a stupid move I made when reaching for something else on the shelf above. Luckily it was just the knob on the lid and it was a clean fracture, so I’ve superglued it back together. I hope the glue won’t get affected by the heat, although sencha doesn’t get super hot. But darn…Thanks for reading my rant. I’m sure you can all relate.",My Banko broke… :’-(
623,tea,,does anyone recognize this teapot? saw it at an airbnb and i'm mesmerized but it's nowhere online
625,tea,,2001 Zhongcha Huangyin
626,tea,,New to me tea pot from my grandmas collection it was the first one my grandfather bought for her years ago
627,tea,,"Making a nighttime cup of Linden tea for my mom and I, first time making Linden from looseleaf"
628,tea,,Teapot found at second hand store. I’m guessing Korean because of the spout.
629,tea,I like to make iced tea and enjoy a little caffeine I used a black tea and nowhere on the package did it say caffeine free and when I drink it i feel no caffeine at all. Lipton I can tell there is caffeine I guess some do and some don't?,How do you know if a certain brand of tea has caffeine or not?
630,tea,,My tanuki kyusu and favourite tea cup.
631,tea,,Yunnan golden buds - A full-bodied black (Before and After)
632,tea,,Does this thick black crust add flavour to my tea?
635,tea,,Bottle of tea as a suspicious object (delays and cancellations at Japanese train station because of tea)
636,tea,,What tea did Tim Dillon have?
637,tea,"I've seen many sources claim that German chamomile is bitter and Roman chamomile is sweet, but I've also seen just as many sources claim the opposite. Which is the sweeter of the two?","Which is sweeter, Roman chamomile or German chamomile?"
639,tea,"So basically, I don't want to mix them up, but I want to have them both around morning.What's the best order to have them?Should I have milk first, and then tea. Or tea first and then Milk?And if any, how long should I wait until having the other one.I know mixing green tea with milk **reduces** it's health benefits. But not having them together doesn't mean they won't mix up... they'll end up mixing up in your tummy. So I want to avoid that.It's a very specific question and might be weird, reason why i resort to human-human aid cuz google can't help with issues like these.",Should you drink Milk or Green Tea first?
641,tea,"Hello everyone, I'm a tea drinker and I'm planning to buy some stuff to bring tea to work. On the same occasion, I wanted to learn how to improve my preparation skills to get a better result on my beverage of choice, so in that regard I have several questions: \- What do I need to make good tea? I'm using tea leaves (not bags) in a cup that is made to prepare to infuse the tea, but it prevents me from making more of it or even transferring it to another recipient. So I assume that I need a kettle and something to boil the water (maybe a 2 in one?). What do you recommend in that regard? I would like something durable (lifetime would be the best) and efficient, I don't mind paying a bit extra if it's not an incoherent amount.\- Next, the leaves. The quality is a factor but how do I recognize the good stuff from the bad one? I'm already going to a specialized shop that got a tea that smells and tastes fantastic if I compare it with basics teabags. But I don't know if it's just an ok tea or if I'm wasting my money on expensive tea that isn't worth its cost. Here's a picture of what I bought for my earl grey: [\- Finally, the technique. Right now I'm not doing anything particular, I boil water, pour it into my cup (in my particular case, it's already in) then add the tea leaves and let it infuse by itself for 5 minutes. Is there anything I should do or pay attention to? Oh, and if you have any advice for someone that drinks mostly earl grey and earl grey variations to try something new, I'm all ears.Thx in advance to anyone that takes the time to read and/or answer me.",What is the best way to make tea?
642,tea,"Hi! I looked around but didn’t find anything in the FAQ about this, so I figured it was safe to post. Can you guys recommend some electric kettles?I had a Moosoo for a year that I loved. Of course, it’s not working now that the warranty has expired. If I plug it in, it just beeps and won’t stop or boil any water. I’m scared to just buy any brand now in case it breaks again so soon, so I’d love to know which ones YOU love if you use an electric kettle.I would love another gooseneck. But, as I understand, it’s not as important because I don’t do pour over coffee. My priority is something that will last, has temperature control, and low budget if possible. I used the kettle maybe 1-2x a day. I only need to make 2 cups of water max at a time.TIA!!!",Electric Kettle Recommendations
643,tea,,My tea collection.
644,tea,,"Tea Harvest Drone (Wuyishan, May 2nd 2022)"
645,tea,,My tea collection during the last 2 months.
646,tea,"Hey guys,Hope all is well.Just wanted to advice on Japanese Green Tea:1. What is the most common brand of green tea drank in Japan?2. What is actually the most authentic Japanese Green Tea?3. In the UK, which brand sells/supplies a good Japanese Green Tea?Thank you 🙏🏽",Japanese Green Tea
647,tea,I loooove hot tea (and coffee) but I can’t stand the heat from the drink and the heat of summer. I never tried cold tea but I just might. I don’t want to add sugar or anything. Is green tea still as good cold? Anyone else do the same thing?,Anyone switch from hot to cold tea during the seasons?
648,tea,"Hi all,I've recently started drinking tea for the antioxidant benefits. I'm starting with white tea as it has a similar antioxidant amount per cup to green tea, but it's not quite as 'grassy' in flavour. I've bought a few Bai Mu Dan teas, but the leaves vary quite significantly in size and colour. Therefore, what constitutes a high-quality Bai Mu Dan? Assuming the same amount of silver needles, are you looking for smaller, greener leaves or is it irrelevant due to the fermentation process? Thanks! :)",Question on Bai Mu Dan / White Peony Tea
649,tea,Any tea that can help get rid of sinus's? Does Lipton Black tea help or matcha?,Help
650,tea,"Hello all! I love TAZO Passion and was thinking of getting more flavors to try. I have also had their Classic Chai, but found the flavor kinda weak. Are there any recommendations for other TAZO tea bags with strong flavors like Passion? I mostly drink herbal, but I’m open to other options. Maybe the dessert teas?",TAZO flavor recommendations
651,tea,"I just switched to a new electric kettle (without a water temperature adjuster) and now when I put green tea in, the water stays pretty much clear. Before, it would turn green or even dark green. Could this be because the water is TOO hot?",Why won’t my green tea “diffuse” in water?
652,tea,,Visited the Harney and Sons flagship while running errands in Manhattan this weekend
654,tea,,Tea 🍵 in the morning sun 🌞
655,tea,I've been looking at his TikTok and I'm just wondering what the general opinion is.,What does everyone think about Jesse's Teahouse?
656,tea,My question is if I buy a tin of tea and let it sit still  sealed for say a year or even more will that tea be better like with tobacco ?,"I’m some what new to tea , been into it for less than a year and I was wondering if yea ages well in the tin so to speak like tobacco."
657,tea,"Just recently ordered these two from Yunnan Sourcing, delivery expected in the next few days. Does anyone have any recommendations on how to brew them/anything that they go well with? What sort of flavour am I in for?",Lao Cha Tou &amp; Tibetan Flame Pu'ers
658,tea,,First time trying Harney &amp; Sons! Looking forward to it :D
659,tea,I usually buy from China for fresh spring tea but would love to buy from Taiwan this year.  Would love some fresh Pinglin Bao Zhong.What is the time at which the oolong and other spring tea come to availability?Might buy from taiwanleaftea.com or Taiwan Sourcing.Thanks !,When will be the time to buy new Taiwan tea from spring 2022
660,tea,,Tea bringing comfort and joy even in the darkest situations.
661,tea,,cute little shakers
662,tea,"Hey, I’m looking for some kind of infusion which would be stronger than coffee to maje me feel awake, any option?If you don’t now anything, could be also any kind whish is at least as coffee!",More efficient than coffee?
663,tea,,The cozy tea room of a friend
664,tea,,This mug that my mom bought few days ago.
665,tea,,Mei Leafs King Peony
666,tea,,Goodies.
671,tea,"Tried tea after years of thinking it was stupid and found I really like it (ironic isn't it? ). But now after looking at all the different types of tea , I see that there are a lot of brands that have the same exact types of tea. Is there a specific company that is known to have good tea and isn't horrifically expensive. Currently I use Bigelow bags and would love to keep using the bags.",why brands do you use?
672,tea,,Tried puer paste for the first time! Richer than regular puer
673,tea,"I am trying to find some good websites to order tea. I am looking for a good variety to include Pu-er, black tea blends and matcha. So far I have came across white2tea but am wondering what else is out there. I live in a small town in the U.S. so not much is available locally.",What are some good websites to order tea from?
674,tea,,Nothing like a good matcha latte!
675,tea,,Trying milk oolong for the first time!
676,tea,,This earl grey supreme is phenomenal!
677,tea,"Newbie tea maker here. I'd like to know the possibilities of using an actual lemon for a hot tea. I know this is pretty basic knowledge, but I want to experiment and see what best suites my tastes.What I've tried so far* Squeeze the lemon juice *after* pouring the hot water and lowering the tea bag* Boil the lemon pulp along with the water. While the final taste of this combination is okay, IMO it does not feel much like lemon teaWhat do you do to get a tangible lemon flavor? Next time I will try soaking a lemon slice into the cup, without squeezing it, and compare the results. Would you recommend including the outer peel as well?",How do you use an actual lemon to have your tea get a tangible lemon flavor?
678,tea,,The most horrific thing we can experience...
679,tea,,Excellent blend of flavors keeping tea forefront
680,tea,,The tea of gods(Black tea + sugar + lemon)
681,tea,"I had my first cup 15 years ago at an old friends house, and it was unlike anything I've ever had. I thought it was amazing and I had many cups accompanied by scones and cheddar, in front of the crackling fireplace. I'm in the mood again, so I bought Fortnum &amp; Mason's version:  It is good, and definitely has the scent, but I don't recognize the flavor being nearly as potent as the version I had all those years back. I want to drink some liquid pine smoke and I want my house to smell like camp fire and this tin does not cut it.   What are your suggestions?*I'm sorry if this has been discussed before. I tried my best of using the search bar but it was without pleasurable results*",Looking for super smokey Lapsang Souchong
682,tea,,I drank a gallon of tea today.
683,tea,,Tea
684,tea,,Tea
685,tea,,I drank at least one gallon of tea today.
686,tea,,addicted
