,subreddit,selftext,title
1,tea,,Went to an apothecary today and got Herbs to make my own tea!
2,tea,,Tonight's cup of tea
6,tea,"I drink tea bought from a tea shop called ""Five o'clock"", and I'm wondering, if I bought a same tea(like typical sencha) from a different shop, would that make any difference? Maybe it was harvested elswhere, but doea this really change anything?",Does the tea brand matter?
7,tea,"yo im new here. Loved tea my whole life and recently got into the ""real stuff"" got me some Bai mudan and Tie Guanyin. Love them Both! I don't have much experience with loose leaf tea as I was just drinking ""tea"" my whole life so I don't know what each kind feels and tastes like...There is plenty of tea content (lol) on youtube so I get to learn about the different varieties but I want to know which one is your absolute favorite out of all of the ones you tried.Talk to me",What's your favourite tea? or tea type?
8,tea,,surprised how good these are! i am pretty picky. found in my grocery store.
9,tea,Did I miss the gun this year on that first flush? I had the opportunity to get some from a vendor I trust a few weeks ago but didn’t and now I think I’m SOL. Do any of you know any reputable online stores that might still have stock of 1st flush?,First Flush Darjeeling
11,tea,"Has anyone ever gotten the coffee beans as a reward from adagio? If so, are they good quality and how much do you get? Thanks!",Adagio Rewards
13,tea,"What have you found to be the ideal cup to experience the aroma, taste and texture of tea from? I have tried a variety of typical Chinese tea cups, double walled glasses, glencairn whiskey glass, but they all feel like they are missing something. What have you found to help maximise the experience of drinking tea in the gongfu style of brewing? And what is your go to cup to drink western style tea, I saw the avensi coffee glasses advertised online, has anyone tried them?",What is the best cup to experience tea from?
14,tea,,2015 white tea from Oldways Tea
17,tea,,I love Twinings 💛💚
18,tea,"Hi!Long time tea fan, now getting into more interesting / premium stuff. 1) I have some some excellent loose leaf tea I got with a gaiwan, so naturally I want to brew it gong-fu style. Problem is that some of them have a recommendation of using amounts of water that are more than the gaiwan can hold. To get the best results, should I scale down water + tea amount proportionally, or is it better to use the recommended water + tea amounts with a bigger cup and don't use the gaiwan?2) I have some mate (not a tea, but still). I don't have a filtered straw, or the special glass for it. The packaging recommends brewing it western style, for like 5 minutes, but reading online thats not at all how its usually drank. Worth buying a kit for it or is it pretty close already? I really like it so far. 3) What do I do if I'm drinking a loose leaf tea that can do 12 or even more infusions, but I don't have time to drink them all, or can't share it with others? Can I just put it away, and use it the next day? Feels like being wet could cause it to become worse maybe. Store in fridge/just leave it outside/let it dry, but cover it/...?Maybe I'm just overthinking it haha. Thanks for any help 🍵",A couple questions I didn't find answers to in the wiki
20,tea,"I’ve been an avid coffee drinker since my teens, I’m 30(M), and lately I’ve been noticing my anxiety levels growing so I decided to switch to black tea in the morning hoping it would be a calmer wake up. But I’ve noticed that black tea simply isn’t giving me the same boost in the mornings that coffee used to. I thought black tea and coffee had the same amount of caffeine. Can anyone explain as to why this is? Also, if there is a better tea I should be trying?",Coffee vs Tea
21,tea,,I’m visiting London and staying near TWG. Any recommendations for some of their teas I should try? I drink mostly black and oolong but I’m not particular
22,tea,"The book ""Tea - History Terrois Varieties"" mentions that in 1987 a comission in China chose 22 cultivars as the best ones. Then they only talk about 4 of them: Fuding Da Bai, Long Jing 43, Tie Guan Yin and Zhu Ye.I'm curious what cultivars are in the full list, but couldn't find it anywhere on the internet. Does anyone here knows? Thanks in advance!",Anyone has a list of the 22 main chinese cultivars?
24,tea,,smol. also tried duck shit aroma for the first time.
25,tea,,What is your opinion? Do u reuse your high quality tea leaves the next day?
26,tea,Hi I seen this tea. Its a Dragon pearl jasmine into a raw pu-er. What do you think will it be any different from the white/green blend? Do you think its only a cash grab since the processing of raw and green tea is similar?,Pazhen Dragon Pearl
27,tea,Hope you all are doing well!Is there any tea that doesn't have L-theanine or vitamin C? I'm a huge tea lover but it seems those 2 compounds mess with my ADHD meds. I want to be able to have my tea in the morning like normal again!,Good morning everyone :)
28,tea,,My first time brewing with a Kyusu!
30,tea,,Can You Eat the Tea Leaves in a Chamomile Tea Bag?
31,tea,,Osmanthus black tea from Old Ways Tea
32,tea,"I recently wrote about shifts in consumer preference related to sheng pu'er, about style and pricing changes.  This continues from that, exploring if there is an inexpensive way to have related experience, that doesn't involve spending $80 to 100 on higher quality, natural arbor sourced sheng versions (or $50 for something presented as of more modest quality, or at least better value).  These are ""factory teas,"" less expensive and different versions / style, with tuocha a reference to the shape, compressed into a ball, or bird's nest shape really.  They don't cost much; I just saw a newer Dayi / Taetea version listed for $6 (for 100 grams), and finding somewhat aged versions for around $10-15 isn't so unusual.  Not truly aged though, which are in higher demand.  This style of tea transitions to a warmer, milder, more complex flavor and character range after about 15 years, and bitterness and astringency switch over to other flavor and feel.  This describes what it's like trying them halfway through that transition process, at 7 and 10 years old.[&amp;#x200B;",trying 2010 and 15 Xiaguan and Dayi / Taetea tuochas
33,tea,"I'm planning to buy some Harney and Sons, Historic Royal Palace collection, and I heard one sachet is for two cups of tea. But one sachet is 2.5 grams, so shouldn't that be good for only one cup? I don't have access to the Harney and Sons website, so I can't get their loose variants. I'm buying from a second hand store that sells it at the same price but has less variations. Tea sachets always confused me and I'm not sure if I'm making them wrong, I'd pick their loose leaf anytime because it's much easier to measure. I don't wanna waste a perfectly good cuppa just because I made it the wrong way. So based on you guy's experience, how much water do I use in those weird sachets, is it for one 200ml cup or a 400ml?",How do you measure the water when using tea sachets?
34,tea,,Crystals forming on Cha Kouro? What are they?
36,tea,,We got a man down!!!
37,tea,,We got a man down!!!
38,tea,,We got a man down!!!
39,tea,I wanted to try Earl Grey Tea is there any specific way you are supposed to brew it? Or just anything to refine the taste?,Is there anything I should know about Earl Grey Tea?
40,tea,"Hello, first time poster here! I had the idea of a brew that combined tea and coffee with honey, rock sugar, and a touch of cream into a single beverage. Do any tea experts have any recommendations for the newbie that is myself? Thank you and cheers!",Coffee/Tea combo
41,tea,"More of a rant than a question unless you have some unusual insight about it, I guess. I don't normally give two shits about the illusion of 'authenticity' when it comes to pretty much anything, but really? Why should tea be named according to the same standards as over-marketed weed strains and crappy micro-brewed beers? It turns me off, should I just get over it? Maybe part of it is that I don't want to be expecting a certain taste based on a marketing gimmick and then get something completely different. Plus I'm sure the actual producers they get the product from call it something else, like come on.Also, I have a real question. Why do some of their non-fermented teas come in cakes? [for example](",What's with the weird hipstery naming of White2Tea cakes?
42,tea,,"First gongfu set, I’m obsessed. White tea, peach berry, and jasmine"
43,tea,"Today we were contacted by Crimson Lotus with an unusual request.  They wished to post a notification of a special service they are offering to those of our community that were hit by the mass disappearance of tea shipments from China (from a number of companies) on May19th, 2020.  Many people lost their shipments and some small tea companies lost significant money refunding their customers for these orders.  The disappearance was never explained by the shipping companies.Because this technically violates the self-promotion rules of /r/tea we asked that Crimson Lotus post [this notification in the weekly Marketing Monday thread](  However, the event is set to occur on May 19th on the anniversary, so waiting for next Monday would make the notification too late.We have compromised on posting the notification on this week’s Marketing Monday thread, but calling attention to it with this post.  This is an unusual enough offer, beneficial to many members of the /r/tea community, that we couldn’t resist working with Crimson Lotus to trumpet this event.If you are a person who lost a tea shipment from Crimson Lotus, or ANY OTHER tea company, on May 19th, 2020, you can sign up to receive a free special sheng pu'er cake from Crimson Lotus (plus shipping).  This is a custom blended cake labelled “519 Shanghai”.  It is also available for purchase if you did not lose a package during that unfortunate and mysterious shipping event.  Please see Crimson Lotus’ post in Marketing Monday for the full details.Feel free to direct any concerns about the posting of this event to the /r/tea moderation team.",Pu-er tea cake giveaway to those who lost tea packages on 5/19/2020
44,tea,,I repurposed my win rack to a tea shelf
45,tea,,Picked up more tea for the collection
46,tea,[View Poll](,Which tea is better?
47,tea,"I enjoy most teas but particularly green and I like stuff with hibiscus and rose hips. Or if not tea, best brand for straight dried herbs/flowers that I can use to make my own combinations?",best budget loose-leaf tea on amazon?
48,tea,I was listening to a podcast today and they were discussing using a variable temperature kettle vs boiling and cooling. I use a variable temp kettle at home and it’s got me wondering if I’m brewing tea incorrectly.,Is it true it’s better to boil water then wait for the it cool for the appropriate temperature to steep a certain tea than us a variable temp kettle?
49,tea,,One night of tea is never enough.
50,tea,"Okay, I've been getting into loose leaf tea recently, and the only kind I've had so far was from 'Tea Forte.' I enjoyed it a lot but It was kinda pricey. If anyone can recommend some companies that offers more affordable options, I would appreciate it.",Where to find affordable and quality loose leaf teas?
51,tea,,My new favorite afternoon tea!
52,tea,,I... may have a problem.
53,tea,,Dram Alchemist - Gushu Raw PuErh
54,tea,Like I've started growing my own tea herbs and I'm considering growing some black tea leaves. But I was thinking what would happen if I made a fermented tea cake out of them? Has anyone done this before?,"Theoretically, could someone make a tea cake out of any herb?"
56,tea,,Has anyone used their points on Adagio for the mystery teaware?
57,tea,"&amp;#x200B;I finally had the time to brew tea again and I decided to try the sample of Genmaicha I bought from Grand Tea &amp; Imports. I don't know if it's the way they display the tea in glass jars or if it's the quality of this grade of genmaicha but it tasted pretty average. I'm definitely interested in recommendations.I found it a little nutty, as you'd expect, and surprisingly naturally sweet. I think I like it slightly more than soba because of the sweetness. My mom was much harsher but she likes her tea strong. She'll let it steep for hours. I didn't get a lot of rounds from my 100ml gaiwan so I've spent the rest of the tea drinking old mint tea with ice and agave. I think the mint might be on its last legs but I feel bad just throwing it out.",Genmaicha
60,tea,"How long does it take to start tasting different flavor notes in puer?I have Prosbloom (shou puer) that I’ve brewed twice now, and the only flavor note that I can taste is barnyard. Maybe a little smooth/creamy on the swallow, but no other definitive notes.Brewing specifications:- 5g/90ml- 200F- 10s/+5s- 10 infusionsIs it my brewing technique, or does it take a lot of time to develop a palate for tea? I also have Big O and Planetary Shark Feed that I’m looking forward to trying. Thanks.",Flavor notes in puer?
61,tea,,I started my job at a tea shop! I feel like I never work here because I'm enjoying every moment of it
63,tea,,These are at my local goodwill. Any idea?
64,tea,,"I’ve made an app to track my brews, so I remember how to brew perfect tea"
65,tea,,"I’ve made an app to track my brews, so I could remember the best brew setting"
66,tea,I’m have been meaning to try chocolate tea but I haven’t yet I didn’t really know it was a thing into last year kinda curious on what people might recommend I think it might be a way to drink something slightly caffeinated or that tastes caffeinated I can switch it when I don’t feel like matcha or flavored green tea.,What is your favorite chocolate flavored tea?
68,tea,"I won't have a lot of natural sunlight(only one window). The temperature in my house is minmum 17C, maximum 32C. I live in Poland, idk if that matters.","Reccomendations for the best indoor plants, that you can add to/make tea off?"
69,tea,,"Just a cup o' Yorkshire tea, nothin' to see 'ere"
70,tea,,I went to a tea farm a couple of weeks ago and picked my own tea!
71,tea,"Hello, I am looking for a tea that I can allow to steep and be very bitter, as bitter as black tea that I leave to steep too long. But I also want it to have no caffeine--not even decaf black tea. I have thought that these two things are mutually exclusive. Does anyone have any idea of a tea that could meet these objectives?",Bitter w/o Caffeine
73,tea,,Im not one for milk in my tea (dont yell at me) But this new product popped up at work and I've never wanted to put milk in my tea so badly. Thoughts? The cherry milk would go amazing with this Black tea with Cherries and Roses I have.
75,tea,,"Tried out this new tea, very bold colors. The passion fruit can was very good. I highly suggest"
76,tea,,Alishan oolong in new Igayaki cup
77,tea,,my purple clay pot. exclusively for post ferment white cakes. it's truly among my prized teaware.
78,tea,,Expired tea? Got this as a gift from my in laws (brand is Tazo tea). Would you drink it?
79,tea,"Hi, so over the past couple months, I've started drinking chamomile for stress, sometimes at night. Nothing fancy, just tea bags from the store. Since I was enjoying it, I bought a package of loose leaf and made a cup last night. After drinking it, I experienced what I can only describe as a mild allergic reaction. My throat felt scratchy for hours and I barely slept. Does anyone have any idea why I may have reacted that way since I'd had it before with no problem? It was just organic chamomile with nothing else in it.",Weird Tea Reaction/Possible Allergy Question
83,tea,,I made a new tea tray
84,tea,i am looking for a tea kettle that can warm between 0.5 l or 1.2l where i can regulate the temperature by a minimum of 5 degrees celcius? I have seen quite a view but non that fit my description and i do not see a need for paying 200.-,DO you know any tea kettles that have temperature control (1C or 5C)?
85,tea,,Kansai Competition Kabusecha 😋👀
86,tea,,Safe to Drink? Left this out overnight on the kitchen counter :( is it safe to drink?
87,tea,,Late night pu-er
89,tea,"I want to get into tea, and I wonder if anyone has some affordable and tasty loose leaf teas to take a look into! I recently started liking matcha tea too, so if you have those recommendations too I’d appreciate it! Though all types of tea are welcomed",Affordable tea options to start out with?
90,tea,,I got some tea 3 years ago for a gift and still have some. Is it still usable and how do I know if it's bad. It is Strawberry Moon Tea
91,tea,,A fresh cup of herbal tea from my garden. Creeping Charlie and Lavender
94,tea,,Wait for the bubbles 🤌🏻🤌🏻🤌🏻
95,tea,I feel like my stomach area Is so bloated I drink coffee and poop everyday but sometimes I feel like might still be backed up. Sorry to get graphic,can you lose pounds of poo drinking peppermint tea even if you go everyday from coffee?
96,tea,I’m new to making tea and would like to know if it okay to use a stove top kettle or is it better to add all the ingredients into a sauce pan?,Is using a stove top kettle alright for making Masala Chai?
98,tea,,Nothing like an evening of tea and musicals.
99,tea,,as someone that enjoys l thianine why do most people in Japan drink sencha 80% when there is pretty much no l thianine compared to others?
100,tea,,A love letter to anyone afraid of overbrewing tea - from Floating Leaves
101,tea,"I’m a beginner, and would like to know if tazo is a good place to start.",Opinions on TAZO tea?
102,tea,,Made some of my own pan-roasted brown rice to make some matcha-iri-genmai cha!
104,tea,,this is my collection after first year into this hobby. I live in Lebanon a small county in the middle east. it was kind of challenge to get some of these. rate my collection .
106,tea,,Any idea of what to expect from this tea blend? I added it to my order to qualify for free shipping. Not much of a description from seller.
107,tea,,Hazelnut Cookie tea!
108,tea,,"Alright tea addicts, what's your dream kettle? Looking for temp variable, prefer gooseneck, steeper not needed, and auto start clock would be great. TIA"
109,tea,"Something where the lid actually fits the teapot! Has an infuser, or can hold a standard metal infuser easily. Has the handle on the opposite side of the spout, no top or side handled teapots. And finally, after reading a recent study on microplastics from pouring boiling water onto plastic, also no plastic parts! Looking for 750 to 1000 ml and willing to pay extra for quality/being made in the USA/UK or something a bit more ethical than a nondescript Chinese factory.Two teapots that I'm considering:[The brown betty.]([This guy I found at a local store.]( Sadly it was too small.",Recommend me a western style teapot
110,tea,,Morning Matcha ASMR. I swear I hear the angels singing too.
111,tea,,Can you brew any tea with a Kyusu Ceramic Teapot?
113,tea," I have quite a few tins from Harney and Sons, however they have generally been on the lower end of the price range except for keemun ""Hao Ya A"", which I fill from a bag and go through pretty quickly. However Harney has a sale right now on a lot of their more expensive Chinese black teas, and I figured that now is a good time to try some of those, and they make even ""Hao Ya A"" look cheap in comparison.Harney tins only have the outer lid with no inner lid. I would prefer not to buy more double sealed canisters for things that already come in cans, or put them in bags when they already come in tins and attractive ones at that. I am wondering if there might be a good way to seal the tins without changing them, like an aftermarket solution where I can buy maybe rubber squares of the right size or something I can cut to the right size or something like that? Does anyone have any suggestions here?",Double sealing Harney tins?
114,tea,"A colleague of mine has a Chinese friend who once a year purchases tea from China. He let my try once, without further information and it's pretty good. Now I could join this annual order too. 0,5kg for around 70-80 Euros. Quite expensive. Upon further questioning he mentioned it's ""Long Ching"" (probably *Jing*). I lack of information on this one, after a very very quick research I come to the conclusion - yes that's probably the proper price, but I don't know anything about it.Please give me some opinions. What would you do?",Opinions on Long Jing?
116,tea,Hey I want to get into tea. Not sure what pot and accessories to buy. I think I’d like to start with a small pot and then get a bigger one once I feel like serving others. Not sure sure to buy these from.,Purchase suggestions
117,tea,,Does anyone else agree?
119,tea,Get 25% discount on Nepali teas till May 21 for all teas at Nepal Tea's website!  &amp;#x200B;[&amp;#x200B;Use the code: Teaday22,Curious to try out Nepali teas?
120,tea,,My tea from India 😍
121,tea,,Whats the maximum number cups of tea can one drink in a day? Im having black tea with rose
123,tea,,Good tea
124,tea,"Went to buy a couple books this weekend and also ended up coming home with the perfect mug for tea. I was needing a reason to drink more of it, and I think this is the perfect little cup. 🪴 🍵 ","Found this little gem on a book haul day, I thought this community would possibly appreciate it."
125,tea,"Do you grow/make your own, get it online or locally?Any shout-outs of companies and places welcome! 🫖",Where do you get your tea from?
127,tea,"I’m making matcha tea for my school’s tea booth which we’ll serve to people there. I decided to get a head start by making it two days before, and was planning to keep it in the fridge until then. It was only after I made 2 liters did I start to worry it may become less fresh by then. Will waiting two days be a problem? (I don’t know if this affects anything but for more information, the matcha I make is like 80% milk)",Does keeping a matcha latte in the fridge for two days impact its flavor?
130,tea,"Personally, bigelow teas is one of my favorite tea brands, so I’m here in this subreddit to ask all of the tea experts and enthusiasts what they think about it.","For those in the eastern USA, how do you rate bigelow teas?"
131,tea,,Trying out a new ripe pu-er (and new tea set!) means having an evening gongfu party with my love 🥰
132,tea,,Can anyone tell me more about this yixing teapot? I got it as a birthday present from my parents
133,tea,,Tea Journal: Spring Peach Oolong from white2tea
134,tea,"It's the only white tea they have and it sold out in about a week. A little on the expensive side also for being $17 for only 30 grams. It was only in stock one time since as long as I have been shopping on yuuki-cha, which was march 2020 when the pandemic started. It is such an honor to have tried this white tea. MORE than worth the $17+$25shipping that I paid. SUCH an honor! The FIRST CUP has this beautiful light subtle umami sweetness, very similar to a light sencha. It's like you're drinking sencha but it has been turned into a white tea. I use 6 grams of tea in a larger gaiwan, 4oz of water at 160F for 2 minutes. I can get 5 good steeps out of it, could even push 6 steeps. The last steep I add 10 seconds more. DEVIIIIIIIIIIIINE!!!!!! Who else has a bag?",Who else was lucky enough to snatch a 30gram bag of this Japanese white tea from Yuuki-cha?
135,tea,"Hi everyone. I really like genmaicha. I have tried the OSK brand and also the Harney brand. I really love the savory toasted rice flavor in both, but was wondering if there’s another brand that has a more intense toasted rice savory flavor? Thanks in advance :)",What brand has the most savory Genmaicha?
136,tea,,Oolong on a rainy afternoon :)
137,tea,"Hi, anyone know where to buy decent quality pu er cakes in NYC? I'm looking for a physical location, peraps in Chinatown in Manhattan or the Brooklyn Chinatown? I'm not looking to spend a lot, just something that is ACTUALLY pu er and not some trash in tea bags. Thanks!",Pu er tea NYC
138,tea,,ordered from Amazon. sad day. not sure I wanna even open them.
139,tea,"I think some are, and some aren't, but I've never tried from somewhere else(except like lipton, and this kond of stuff). I'm just wondering if I'm missing out, and their tea isn't close to some other brands(doubt it, but still curious)",Is tea from five o'clock good?
140,tea,,would something like this work as a tea tray until I can save up for a real one?
141,tea,"I have some japanese oolong from yuuki-cha. The ""Baisen"" oolong. I usually brew it using 4.5g of leaf, 6 fl oz of water at 185F for 2 minutes 30 seconds. BUT....there's a lot of caffeine when brewed western style like this. Is it possible to do gong fu like how I do with my chinese oolongs?",Have any of you done gong fu with japanese oolongs?
143,tea,"Hello ,I am moving to NJ soon and would like to know where to buy loose tea.Specifically interested in oolong teas.Willing to travel for a good shop .Thanks",Best loose tea shop in New Jersey?
144,tea,,A very nice yard sale find.
145,tea,"Hello ,I am moving to NJ soon and would like to know where to buy loose tea.Specifically interested in oolong teas.Willing to travel for a good shop .Thanks",Best Loose Tea Shop in New Jersey?
147,tea,,What do you think about Korean Tea? How does it compare with Chinese Tea and Japanese Tea?
148,tea,,Wu Yi Shan “Huang Qi” Rock Oolong 2018
