,subreddit,selftext,title
1509,tea,"Hi all,I've jumped on the matcha train! After doing my research, I've decided to ditch coffee so I can reap all of the benefits of matcha; I am very excited!I just received my first packed of Encha Ceremonial Grade and do, however, have a few questions.I am used to making an cold latte in the morning in a 18oz cup. This used 2 shots of espresso, followed by filling the rest of the cup up with milk. I'd say 16oz milk.I am wanting to replace the espresso with matcha powder, therefore, I am wondering the proportions.I read on the Encha site to mix 1 tsp of matcha powder with 2oz of water, followed by 5-6oz of milk.Because I still want to consume generally the same amount of milk in the morning, I am wondering if I should do 2 tsp of matcha powder with 2oz of water, followed by 16oz of milk? Or should I do 2 tsp of matcha powder with 4oz of water, followed by 14oz of milk?Side question, I am also wondering why Encha suggests to mix the matcha powder with water first, prior to filling the cup up and mixing with milk?Thank you so much in advance! I look forward to hearing from you!","New to matcha, seeking advice about ratios!"
1510,tea,,Cranberry Hibiscus with Honey to welcome Spring
1511,tea,"I bought the best matcha I've had in my life from Japan, but the customs offices in Greece made me pay 100% more for fees. So I'd like to buy something similar from Europe, in order to avoid paying exorbitant fees.What are some of your favorite brands of great umami flavor matcha powder?",What are your favorite matcha powder brands available in Europe with a high umami flavor?
1512,tea,,Novice dragon well review: early spring 2022 YS 'bao hong' vs 2021 cheapest option on aliexpress
1514,tea,,"New here, looking for calming teas, not just bedtime teas."
1515,tea,,This cat is a gem
1516,tea,,Experimenting!
1517,tea,HiI had a lipton tea package from 2010_2011A relative brought from franceCuz i couldnt read anything french (i was 10...)didnt look for the name of it(you know like it says vanilla or chamomile)The pack had a bright purple color and picture of  cinnamon and roseCouldnt find anything by googlingAnyone knows anything to help me?,Help find tea
1519,tea,"[Peraps its my personality but I have a tendency to overworry and get stressed whenever I'm drinking coffee or tea after the morning. It'll be 1pm and I'll have a whole fit about whether or not I can start a new gong fu session or if that's gonna mess with my sleep.This study is a few years old and I haven't seen much else on it in the research (I spent an hour or so yesterday looking) but it *does* seem to be one of the larger caffeine-impact studies that I could find in terms of population, but it was short term (&gt;700 people, about a week of sleep on average). It's based on a self-reported survey and was a population of African Americans. Still, I can now rest easy (no pun intended) when I decide that, yes, I do want to crack open that cake even though I'm finished with dinner.","Good news, folks: we can drink without fear of insomnia"
1524,tea,,Tasty decaf vanilla chai
1525,tea,,new teapot for the collection. :)
1526,tea,This is what I’m ordering from What Cha and would love recommendations. I am not big on Black tea so any other suggestions are welcome!Four seasons oolong -TaiwanRed oolong -TaiwanAged Tie Guan Yin - China Fish hook green tea - VietnamMystery tea (read good reviews on this sub!)Nilgiri Dragon well - India Sencha of the earth - JapanThank you !,Help me improve my What Cha order!
1527,tea,,Guess what this tea is
1528,tea,"I just got back routine lab work, and it is showing my iron levels to be lower than normal (which may explain my recent lack of energy).  I'll be speaking with my doctor next week, but one potential cause of this is that black tea can block iron absorption.I love my black tea in the mornings and would miss it intensely if I can't have it.  So without running afoul of the rules of this group, what substitutes could I start looking toward if I have to cut out or cut down on black tea?",iron Levels
1530,tea,,Taiwan Dong Ding Oolong Sourcing Trip
1531,tea,"Serious question here.The smell of Earl Grey, right after you open the bag for the first time, is by far my favourite smell. I have searched far and wide through all the local candle stores, Winners/Marshalls/TJMAXXs, craft sales... and no luck. ""Tea""-scented candles aren't strong enough, and bergamot candles just smell like citrus.Has anyone ever had any luck at finding one that actually smells like it? Walking around with the tin under my nose is a bit ridiculous.Thanks all.",Has anyone ever found a candle that actually smells like Earl Grey?
1532,tea,,My first ys.us order! Arrived within 4 days of ordering! so efficient! which should I start on?!
1533,tea,,What is the best brand of tea bags?
1534,tea,,"Got my first Crimson Lotus order…and my first clay tea pot, a black Jianshui. It’s so tiny and cute!"
1535,tea,,who has the best tea subscription service?
1536,tea,"Hi! I know absolutely nothing about tea, but I'm looking for a tea to substitute drinking coffee. I want tea that has quite a bit of caffeine. Any recommendations? Thanks!",Coffee replacement
1537,tea,,"My 3 favorite loose leaf teas, can you guess what they are?"
1538,tea,"My mother is going to a tea ceremony. They’re serving “gateway of the spirit (Shen men) purple bud tea”. We wanted to know more about it, so we googled it. But, the only two places that sold it seemed sketchy. (Living tea &amp; producers market) They claimed it could help all kinds of health problems, One vender wouldn’t show you the price until after you made an account, and they both had the exact same, word for word, description of the tea. Any info? On the tea, or the tea venders.",Any opinions on Living Tea?
1539,tea,"I'm attempting (for the millionth time) to end my coffee addiction by switching to tea. My plan is to start making chai (a drink with all my favorite spices? yes please) using one of these as the base (and probably making it un/lightly-sweeneted since I don't like overly sweet things). I'm looking to kill two birds with one stone and pick whatever has the most health benefits, and decent quality on a budget.I tried googling a bit, but most of what I've read is contradictory. Some sites say green tea is the healthiest, others say that rooibos is better, and some are talking about green rooibos (which I've never heard of). I've also been reading some controversial reports about lead and other heavy metals in tea, but it seems like a highly debated topic. It's all left me a little lost on what is ""good"" versus ""bad"".In any event, I used to get tea from Stash in the past. They have an organic loose Rooibos from South Africa and an organic green tea sourced in Brazil with a decent price (under USD$10 for 100g). Are these good teas or should I be looking elsewhere? Thanks!","Rooibos, Green Tea, and Green Rooibos"
1540,tea,"Hey there teafolk,TL;DR: whats a good way to keep/obtain boiling water for fresh brewed tea during a hike?This spring I'd like to have some nature outings and take time while I'm out to have a mini tea-picnic in serene settings. There are some wonderful travel gongfu sets out there these days, but I'm wondering if there's anything out there that can really keep a container of near-boiling water for a few hours.Lets say I boil water at home, put it in a pre-warmed vessel, travel 0.5-1.5 hours, hike for an hour, and then want to make a pu'er to share with my friend(s) (so at least 500-700ml). In a typical thermos I'm skeptical that the water will remain close enough to boiling to be useful, though peraps for a green or oolong, maybe black if the trip is on the shorter side. A video demonstration from Zojirushi shows about 40 degrees drop from boiling in 6 hours, so if we can assume linear drop, that means -20 degrees after 3hr, bringing it to about green/oolong territoryThere exist car-lighter powered boilers, but I often won't be traveling in a car. [Another redditor explained why it's unlikely a USB powered kettle would exist]( but this also assumes you're boiling water from scratch, I think it wouldn't be so bad if you were using fairly hot water like in the above scenario and using a heating element to slow the temperature drop...Which brought me to the existence of temperature controlled travel mugs, but from what I can see these are also almost all car-powered, though a few battery powered ones are out there but they mostly top out around 140F.Lastly there's the camping approach, but almost any fuel stove and pot to boil water will be bigger than the entire travel gongfu set, so unless I was actually camping I think this would be untenable for an enjoyable hike.Anyone have any other ideas? Have I unfairly discounted one of the above approaches? Or does anyone have experience trying this? Maybe the tried and true thermos is ""good enough""... I know I can always lower my expectations, but if it's possible, I'd love to make it happen.",Gongfu on the go (ie hiking) - whats the best solution for boiling hot water? Do actively heated ones exist?
1541,tea,,2 Tea Plantations 茶園 England &amp; Taiwan Tregothnan tea grower meets a Ping...
1542,tea,,Birthday Session!
1543,tea,"Good Morning Everyone,I'm just curious, is there a company/brand/etc of Tea, that would be similar to the likes of Deathwish coffee?Basically, High Caffeine, Good Flavor, Etc.",{Tea Recommendations} - Deathwish Coffee - Tea Equivalent
1544,tea,"Hi y'all! I have been using a gaiwan to brew tea for a little while, and have yet to find a solution to this problem: how do I hold it to pour without burning the absolute crap out of my fingers? Do I just have to toughen up and accept the burn, or is there a better way to hold the thing?",Tips on Using a Gaiwan?
1545,tea,"First of all, sorry if posts like this are not allowed, mods please delete if that's the casei have been a long time tea drinker, different flavours, with sugar, honey or pure (tried with milk once but i guess i didn't have the correct kind of tea ?)  but i have never gotten into the ""sit down and enjoy"" part... i am more of a practical person and i prefere making a litre than a cup...since having dipped into trying different kinds and also some more ""expensive"" mixes (still from the supermarket though) i would say that i taste the difference, but i never really had a ""wow moment""having dabbled in different forms of trinking tea, i always thought there has to be ""more""...people wouldn't make such a big fuss about it  if there wasn't...so i guess the tl;dr is if there is ways to enjoy tea instead of drinking, or if it comes down to quality of blend or any other factorif there is a "" starting guide"" i would be glad to read it (haven't found anythin in the sidebar on my mobile app, if there is i am sorry)again, sorry if this mind of post is not wellcome, and thank you in advance for every pointer or shared experienceps: dunno how you guys here think about the topic, but shoutout to the spiffing brit for strenghtening  my curiosity  about that topic","I like to drink tea, but how do i learn to savour it?"
1547,tea,"Hey everybody, I just bought my first three camellia sinensis exemplars and just wondered if anyone of you also manufactures their own tea at home?If so I'd love to get some tips on getting them to grow fester and allowing me to have more than half a cup of selfmade tea.",Anyone has their own teaplant?
1550,tea,,"Mmm, Darjeeling"
1551,tea,"Hello, I’ve been wanting to get into floral teas but don’t know where to starts! I’ve only tried chamomile in terms of floral teas.Also, please let me know where to get them.Thanks!",Floral Tea recommendations?
1552,tea,"The wiki says, “Assuming you are interested in loose leaf tea, the most basic setup for a beginner would be a cup and strainer or infuser (avoid small or novelty infusers).”Thoughts on what’s a good tea infuser/what do you all use?I currently use a tea ball, but it has a little plastic bit that isn’t dishwasher safe and it’s tiring needing to hand wash it all the time. Also little leafy pieces come out of the teaball often, as it’s getting looser. Preferred qualities:-	Dishwasher safe-	Can hold up to 2 cups of tea-	Strainer doesn’t let out little leafy bits-	Budget $30-$40At Chinese tea places in my hometown, Ive used a little narrow glass thing that I’ve enjoyed, but I’m not sure what that’s called and/or if those are dishwasher safe.Thoughts? If no recommendations, am still curious about different tea set-ups that are out there. Thank you for sharing!","Recommendations for dishwasher safe, 2ish-cup tea infuser set up?"
1553,tea,"Hey there! I’m new-ish to tea, and have decided to approach *camellia sinensis* by doing overviews of the major origin countries, starting with China. I’ve had a little trouble trying to determine a reliable list of  the must-haves. So far I’ve ordered:* Longjing* Tie Guan Yin* Black Gold Biluochun from YunnanCan you help me fill in the rest of the list? Shops you like to order from would be helpful too! Thank you!",Take me to China (spiritually)
1554,tea,,"Modern Balled-Oolong Rolling Process (“Gunpowder"" tea) in Taiwan"
1555,tea,,where can I find high quality genmaicha?
1556,tea,,"Rain in the tea fields of Assam, India"
1557,tea,,Anyone had this tea before? It sounds good to me but want some opinions. Thanks!
1558,tea,,Relaxing and enjoying a 2012 Lincang Shou Pu-er (Puer)
1559,tea,"&amp;#x200B;|2012 Lincang Shou Pu-Erh (Puer)||:-|| *漢字* 一二年臨滄普洱熟茶 || *origin* Lincang, Yunnan || *craft* shou (fermented) |This is one of my favorite teas. A Shou that is quite mellow with a great texture. The flavors I find are earthy, grassy, cherry and molasses. The Hui Gan is very nice and persistent. The sweetness lasts quite a while in the mouth and the throat. I highly recommend this tea from Red Tea Blossom. Expensive, but certainly enjoyable.",Relaxing with a cup of Lincang Shou Pu-Erh (Puer)
1560,tea,"Hi all,I drink loose leaf tea almost exclusively, but bagged tea is very convenient for travel. Living in Switzerland I have found a few good brands (Sirocco, Länggasstee) that offer tea pyramids with good loose leaf tea in them, but I end up paying something like 0,60-0,80CHF (US$ 0.70-0.90) per bag that way.In the US in the past I had bought Numi teabags in bulk pack (100 ct) which is currently about $0.35/bag. I never thought Mighty Leaf justified its price premium over Numi, FWIW.Filling my own tea pouches would somewhat cancel the convenience of bagged tea for travel, so I am definitely looking for prepackaged bagged / pyramided teas.Any recommendations for bagged high quality black teas (nothing exotic, it could be an ""English Breakfast"" or a ""Yunnan Golden Special"" or something like just a decent Assam, Qimen, Darjeeling, etc)? I am currently looking at Tealyra. I've ordered loose leaf tea from them in the past with mostly  positive results. I realize they aren't viewed as a really excellent / expert provider, but I'm not looking for niche teas, just pretty darned good bagged tea - ie, better quality than Numi but less than the $.60/bag I am paying in Switzerland :) I've never ordered from Adagio but they're pretty pricey for bagged tea...All ears and open to all opinions / abuse / insults hehe :)",Please suggest a vendor for premium bagged black tea
1561,tea,"im not looking for splash of milk builders brews (which i also enjoy making), but maybe more involved recipes (and rich tasting). anything from hong kong style to milky spiced chais and taiwanese milk tea. im especially interested in any personalized recipes you've developed. any tips with different sweeteners, dairy / milk, spice blends you use? creative tea blends?",give me your best milk tea recipes!
1562,tea,,"chickadees come to tea, my newest oil painting"
1563,tea,"Okay so i really love tea. Especially with a spritz of lemon juice. But the problem is i dont know where to start, ive been drinking cheap tea all my life like lipton and never loose leaves. I enjoy all kind of black teas especially with fruity/flowery flavors. Not really into rooibos/vanilla/… also not a big fan of green tea but this could be because i only drink lipton green teas and i heard they taste bad. Any advice for a starting tea enthousiast? Thankssss",Where to start
1564,tea,"I’ve been drinking Tazo Zen for a few years and really like it, recently I’ve gotten into loose leaf teas but haven’t been able to find a similar flavor to Tazo Zen. Does anyone have any recommendations?",Tazo Zen Loose Tea Alternatives?
1565,tea,"I recently hit up a sale and ordered several new varieties, and some of them are amazing. Others really didn't hit the mark for me- they sounded interesting but were just kind of meh in aroma and flavor. What do I do with them now? It feels goofy to hold on tp teas I don't like, but I also don't want to just toss them, you know?",What do you do with teas you don't like?
1566,tea,,"For tea person, would you like to live in an ancient old house for days, pick up tea leaves in tea garden, make your favorite tea by hand in tea season? There is going to be a tea-making DIY activity this autumn, so I am wondering if there is one interested in it."
1567,tea,"I've heard a lot of good things about it, but i just cant seem to get it right.",How to prepare Yorkshire Tea?
1568,tea,,Hmmm
1569,tea,,Berry Tea with CBD infused Manuka Honey - Delicious and relaxing
1575,tea,"I am aiming for the following- as few plastic part touching water as possible, preferably not glass, too clumsy to live with glassware- from a relatively reputable brand so that the following point won't happen- won't burn through the kettle or base in less than 2 years like a lot of the cheap stuff on Amazon- is in stock- under $60, not a hard criteria, but if it can get cheaper, I am all for it.Not really looking for any features, I just need the most basic electric kettle function to shut off on its own after boiling the water.I had problem coming across something that is budget friendly and not having plastic. Most Hamilton Beach and Salton kettles have those plastic volume meters on the side. I'd rather not having a meter at all than having a plastic one. Does the Hamilton Beach Gooseneck Kettle have any plastic pieces touching the water? It doesn't seem to have the volume meter at a glance.","It's that electric kettle recommendation thread again, in Canada"
1577,tea,"I have recently gotten into making my own milk tea at home, but to get a good body of tea flavor to come through, you need to make a really strong brew.Those usually end up having too much caffeine than is good for me. So I was wondering if I could blend in a decaf black tea to add some extra body without adding too much caffeine. Does anyone have a recommendation for a decaf black tea that would work for this?",Decaf black tea recommendation
1578,tea,,new te pot and cup(not from the same set XD)
1579,tea,,Guys....do I have a problem?
1582,tea,,Found this subreddit just to warn people. This is one of the most vile things I've ever tasted and it smelled like BO :(
1583,tea,"I've talked to a doctor and he says this isn't serious but couldn't explain it.I want to drink beverages other then water and tea is one I'd like to drink. However, even an ounce or two of tea makes me insanely tired and relaxed. I fall asleep and can't wake up or stay up no matter how hard I try.When I sleep, I wake up like 3 hours later feeling well rested but the feeling of being so tired I can barely make it to my bed in time to sleep is concerning.Anyone else have this?",Reaction to drinking tea
1584,tea,,"This year, I went to the 2022 World Tea Expo in Vegas! Here is my overview…"
1587,tea,,What is this spoon for?
1588,tea,,Good Night Tea (Blue Earl Grey)
1590,tea,When I make hot tea I normally will steep leaves twice with my second cup steeping a little longer. My question is can you use the leaves from a cold brew for a second steeping?,Cold Brew Tea
1591,tea,"Hi there,Is there a guide to sorts of tea per hour of the day?",Sort of tea per day hour
1592,tea,,Something we should do on r/place
1593,tea,,I was separated from my teas and tea sets for a long time. Finally a reunion!!
1594,tea,"Hi! I’m pretty new to tea. I switched a couple years ago from coffee, which upset my stomach. One of my favorite things in the world is a matcha latte but I also drink a lot of English Breakfast tea. I’m looking to try some new black teas and expand from English Breakfast. Do you have any recommendations? I’m not really a fan of earl grey btw. I’m also thinking about some good iced teas for the warming weather coming, so if you have any fav iced that would be cool too! Thanks to this group for all the info and education. And beautiful photos! Keep it up.",What to try next?
1595,tea,"Just recently was gifted some spice containers from someone moving out of my apt -- figured they would be an improvement over the resealable bags I got my tea in (the seal on some of the bags was breaking).   Gave the containers a thorough wash, and afterwards they had no smell whatsoever. 2 Days later I open my Dongfang Meiren and all I could smell was onion powder (Dongfang Meiren instant noodles anyone?). I read up that sometimes you can kill the smell temporarily but it'll come back, which I didn't know at the time. Not all of my teas were heavily scented, some weren't even bad after absorbing the spices (cinnamon puer and cloves green tea smelling like upgrades). But I would still prefer to get my Dongfang Meiren, Tie Guan Yin, Da Hong Pao, and Dragonwell back to their original scent. Anyone have any suggestions on how to fix it? I've taken the tea out of the containers and set them flat on my counter, hoping that'll make at least a small improvement, meanwhile I'm washing all of the containers on high heat in the dishwasher.",Deodorizing Tea
1596,tea,Where can I find a good matcha wisk and a ceramic bowl with a lip for pouring? Thank you ☺️,Matcha wisk and bowl
1597,tea,"I recently started getting into tea and fell in love with Lady Grey by Twinings.  Everything I read says that loose leaf is better so I ordered a tin of Lady Grey loose leaf, but I just can't seem to make it taste as good as the bagged version.  The bagged version has a richer, deeper flavor and the loose leaf is weaker.  1 bag in 7oz boiling water with 4 minute steep is rich and flavorful.  For loose leaf  I've tried same amount/temp water with 1tsp with steep times of 2,3,4, and 5 minutes, and 2 tsp for 4 minutes - I just can't seem to replicate the bagged taste. This is my first loose leaf, and it's kind of disappointing that it isn't as good as the bagged version.  Any tips/tricks that I could try?",My loose leaf vs bags struggle
1598,tea,,Which one would you recommend?
1599,tea,,Casual Sunday tea morning
1600,tea,,"Best tea-related purchase I've made recently, these nifty little tea sliders have really come in handy with all the samples I've been buying."
1601,tea,,A day at LaoBanZhang Village - the No.1 Village for Puer Tea
1602,tea,,This is where my Gyokuro leaves go when they are finished
1603,tea,,My current tea setup! So quaint!
1604,tea,"I love drinking tea throughout the day but that’s not really the setting for gong fu, can’t be pouring tiny little cups all day. I know a lot of people brew grandpa style but I find it quite annoying to keep heating and pouring more water in the cup as I drink, since I always need to wait for the water to get hot. Ideally, I’d want to have a big pot full of tea to drink as I go. Unfortunately every time I’ve tried to upsize my green tea cup to a pot, I find that it gets very bitter. Of course I take the leaves out after brewing time but as it cools in the pot, the tea still gets bitter. I’ve also tired to make a big pot of oolong but it just didn’t have the flavour or texture it does gong fu style. So I’m asking you! How do you like to make lots of tea? Do you have an exciting secret method? Or do you just not drink green tea when you want a lot of tea? I do like to cold brew over night but we’re having a bit of a winter moment where I live and I’d like my tea to be hot.",What’s your go to method for brewing large quantities of tea?
1605,tea,,My sister got me these from here trip in Dubai. Anyone know the best way to brew it? Badly need help. Thanks!
1606,tea,,How oolong tea is traditionally roasted over charcoal
1607,tea,I’m would like to support an Etsy shop instead of Amazon. Does anyone have any recommendations?,What are your favorite tea shops on Etsy?
1608,tea,"I really wanna start drinking tea. I don't have the best experience with it let's say, let me explain.So I wanted to start drinking tea/black coffee like a year ago, and introduced the both of them gradually to my diet. I didn't like black coffee at first but over time, I learned to love it (it tastes great to me now). For tea however, I haven't introduced it to the same extent, probably because my parents don't drink them = don't buy em.I drank ginger tea as a child and that was somewhat traumatic as a kid. Started chamomile tea a year ago (thinking I'd like it) but it only tasted like.... flowers? I onlt had like 5 cups. I've pretty much only had like 8 cups of hot tea throughout my life, which probably impacted its taste for me.I want to drink more of it and get its acquired taste, just like I had with coffee. Don't know where to start though. I'm thinking green tea is a safe start but then again my knowledge about this all is limited. Any help is appreciated, thank you!",Where to start?
1609,tea,,"Finally acquired my first tea table, no longer will I brew over a towel"
1610,tea,,Drinking (and eating) some pre Qingming Anji Bai Cha
1612,tea,,Sampling some 2022 Anji Bai Cha a my local teashop
