,subreddit,selftext,title
1103,tea,So...this is going to be a bit of a weird question.  I had to deal with some limescale in my water kettle and my mom decided to boil vinegar in it to get rid of them.  I think she also put some baking soda.  Now...we have rinsed it off and boiled water in it multiple times..but it still has a slight vinegar smell...not extremely noticeable..but my question is..if I were to cook tea and drank that water..could it have some negative effects on my health or digestive system?  I know it's not actual boiled vinegar I'm ingesting but I am still scared of it having some kind of an effect that might not be noticeable at first or damage to my throat etc...,Is the water from a water kettle that smells like vinegar dangerous to drink?
1105,tea,,Got this cute tea set at a flea market for my birthday!
1106,tea,,Safe to Consume?
1107,tea,I've been doing the coffee thing for a long time now. I want to start brewing some quality tea however I have no idea where to buy good tea.,Tea.
1108,tea,"I just got a box of 100 tea bags (I’m obsessed with Stash jasmine green) but they’re just tossed into a beat up shipping box. I’m worried they’ll not keep, but they are individually sealed as they would in the normal sized boxes for purchase. What are some good ways to keep tea bag sleeves? I’d like to not keep them in a drawer in a box, but peraps a big jar or are there any containers made for this to go in my tea corner? Thanks I’m advance!",Storage ideas?
1109,tea,,"Just got my first teapot/teacups (Kyusu), I’m hyped to use them, but how do I clean these without damaging them?"
1111,tea,,blue drink
1112,tea,"Apparently there are some regional differences between how London Fogs are served. I am very curious to where you are from, and what you expect when ordering a London Fog![View Poll](",What do you expect if you are offered a London Fog?
1113,tea,"Using Bigelow tea bags but they're harder on my stomach than coffee, wondering if I'm steeping them too long?","New to green tea, how long should I let it steep for?"
1114,tea,,"YS Yunnan ""Pure Bud Silver Strands"" First Flush Green Tea"
1115,tea,,"Wondering if anyone knows anything about this tea or brand. Found it in a shop with my mom, and I really love it. But to be honest, I'm new to loose leaf teas and teas that aren't just found at any old super market, so I don't know how to judge quality very well yet. Thanks!"
1116,tea,,It’s bloody loveleh
1117,tea,"Hello unfortunately my grandad has passed away and I have inherited some china tea cups. I'm wondering if anyone knows anything about these and any potential value. They look quite rare but I have no knowledge on this sort of thing. I'm told this is only half of it, I'm still get to find the rest.Thanks!Photos:",Inherited some China tea cups
1118,tea,Hello!I'm looking to replace my morning cup of coffee with tea.What are some good types and brands?The one that keeps coming up when looking for good morning teas is earl grey.I would like to try it but I don't know which brands to trust.Also is it bad to use bagged tea as opposed to leaves? P.S: I live in the EU so I need recommentstions that can be found here.Thank you!,Beginner looking for morning tea recommendations
1119,tea,I've recently gotten a bunch of loose leaf tea and I'm not entirely sure the best way to store it. In the past I've just left my teas in the paper bag they come in and it's gone stale within a few weeks which I really want to avoid this time around. Are normal jars okay to store tea in or do I need something more specialised?,How to properly store tea?
1120,tea,"Anyone else trying this? How do I turn this stuff into tea one it starts to thrive?I'm still working on the ""getting it to thrive"" part","Ok, so I'm growing tea camelias"
1124,tea,"When you brew tea, do you usually make one cup or multiple cups/infusions?[View Poll](","When brewing/reviewing tea, do you make multiple infusions?"
1125,tea,,2022 Pre-QingMing Lion Peak LongJing—so good it restores your soul!
1126,tea,,My very basic messy tea collection. Nothing special but I love it.
1127,tea,,I found possibly the coolest teapot ever in a thrift store for $3. I can't wait to brew up my faves in this!
1129,tea,"I am truly excited to be putting in my first order for White2tea but I had a few questions if anyone has personal or anecdotal experience someone would like to offer. First, in most excited to be ordering one of their smoked pu-ers. I haven’t ventured into smoked yes but the consistent reviews of “tobacco” and “campfire” sound lovely, but they come in at very different price points. • 2006 Old Bear Fengcha • 2021 PyroladI am excited to order both if there is enough variation between the two, but if one is recommended much higher I’ll save a little on the Smokey variety. Second, this is my first specialty order altogether. I’m looking forward to the higher quality of experience in a tea, and I’m looking at buying a slightly more expensive cake to celebrate my recent birthday. The two in the $100ish range that catch my eye are • 2015 Pin• 2019 Both Steal BatsThey seem to have similar ratings and recommendations. They are both described as ready to enjoy now or to age. I know things will be different from person’s pallet to pallet, but if anyone has a recommendation of one to bump up to the 200g cake size, let me know!Thank you in advance, and I’m super excited to be stepping into a new level of tea exploration and try something “better” than box stores offer regularly! Cheers!",Questions on my first White2tea order
1130,tea,,Looking for Dan Cong Vendors
1131,tea,,It is a sad day :( so closing to finishing the bag of tea
1132,tea,,I need a better tea infuser. Any recommendations?
1133,tea,,Tea is calm Coffee is angry
1134,tea,"Hi everyone, up to now I've always used the generic stainless steel mesh semi conical filter like these[One problem is that they tend to get crud buildup around the weld where the metal meets the mesh. I'd like to find something better that is easier to keep clean and possibly imparts less flavor. The problem is that the ones that are solid metal or ceramic usually have little holes instead of mesh which allows more particulates to pass which is unacceptable.I've been considering the funnel from the Keith titanium ti3911 coffee brewer which does have holes, but they seem really really small since their is 26,000 of them and they are laser cut conically so as to be easier to clean. But it's very expensive for a single piece of kit. Does anyone have anything better or some other recommendations? Thanks!",Best Tea Filter For Gongfu?
1135,tea,,Which addons do you prefer for black pu-er ?
1136,tea,"Hi community!My tea friends and I had over 10 years of Chinese tea experience. We tried different teas, different methods of brewing, teaware, water and etc. We also did tried different addons to tea during our long tea ceremonies. After a long time we come-up to one interesting idea.As you know tea grown, harvested, cooked (prepared) and fermented by people as wine. Sometimes with same idea of process and consuming: evening, fire, glass, ceremony, aged wines, cozy time, grape and..... blue cheese. My question is:Did you tried Black (shu) Puer with the blue cheese (or another cheese with mold)? If yes - please share your experience.It is also interesting to know what other addons you think are good with pu-er.",Which addons do you prefer for Black Puer?
1137,tea,,Homemade Bubble Tea Using Cold Brew Kukicha
1138,tea,,"My honeybush and hibiscus mix looks completely like red tea,it's funny that it almost perfectly resembles its color"
1142,tea,,One of my fav piece came in today
1143,tea,,Evening dilemma
1144,tea,"Hello everyone, I love tea, and my favorite way to brew it so far has been out of larger 150ml+ gaiwans. I know it's not exactly ""orthodox"" for a single person but hey if tea isn't about creative expression and individuality what is?I'm looking for recommendations for plain white porcelain large 150ml+ gaiwans. I've already got a small collection of mid tier gaiwans in that range and now I'd like something nicer. Money is no object I just want the nicest gaiwan I can find. What have you got for me? Any help is greatly appreciated. Thanks!",I like big Gaiwans and I cannot lie: Please Make Recommendations.
1145,tea,,Tea time in Watsonville California: my new tea drinking gear!
1146,tea,,"I ordered wintergreen off amazon to make root beer with. it tastes like some crappy green tea, and smells and tastes nothing like wintergreen oil, is this how it is supposed to be?"
1147,tea,"So I’ve always liked Chai Tea Lattes. Usually from Starbucks or other coffee shops. Until I had a REAL chai tea latte from a local Indian coffee/deli shop last week. Holy cow the difference. It was AMAZING. Not a sugar overload. Just straight flavor, and spice, and fantastically smooth. My wife and I are hooked. I’ve looked up recipes (and the cafe was even nice enough to explain how they generally make theirs) and it seems that it can take quite a while to make these by hand. With 3 kids and work it can be hard to have time to do that prep in the mornings. However, we happen to be in the middle of a large kitchen remodel. We have space to put in an in-cabinet or countertop latte machine. Are there any good latte machines out there that would help in making these at home a little quicker? I came across Chime, but it seems that’s solely for Chai Tea Lattes and is pod-based. I would like to get something that isn’t pod-based (I hated having a Keurig), and that we can use to make a number of different drinks if we wanted to as well. I’m new to all of this, so please any ignorance I have on this. TIA for any advice!",Best Machine for making Chai Tea Latte
1156,tea,,Never been 'Tea Drunk'? Then You Never Had This Much Tea in Just 1 Hour
1157,tea,"My work gaiwans  can use your help!They were unfortunately left in the office this past Friday evening when a crew came through and disinfected desk surfaces. I have no idea what they used; all we’ve been told is it’s called “e-mist.” My boss packed the gaiwans up in the box you see behind them in the photo and put it all in an overead storage. Supposedly, just the exposed desk surfaces are misted, so theoretically anything above that level would be untouched.Having said all that, one of the gaiwans did have wet tea in it (it’s really dry here and it was overnight, so little chance for mold), and of course clay is porous and absorbs nearly everything. I mention this because it’s possible if any disinfectant reached this gaiwan, the wet tea would hold onto it.As a precaution, I would like to clean these out but I’m unsure how to proceed.  Originally, I thought placing each one separately in boiling water for about 30 minutes would do the job, but I’d like to get input before I proceed. These gaiwans are well on their way to being wonderfully seasoned, so I’d like to avoid anything that would undo that, but of course food safety is the priority in this situation.",Gaiwans need intensive care (maybe?)
1158,tea,,Gaiwan intensive care
1159,tea,,One of my best tea purchases is this cheap $3 scale! Made my western style tea for office more consistent and quicker!
1160,tea,"Should coca leaf tea be illegal?  Have you ever tied it?If someone enjoys drinking a cup in their own home, not hurting anyone, is that OK? Is that the govt's business? Is that YOUR business?Can/Should unjust laws absent a victim or risk be ignored?And if someone decides to ignore an unjust anachronistic law that doesn't hurt/protect anyone, to improve their life and health, is that OK?If that someone posts on reddit, seeking to exchange information with another likeminded adult on ""procurement"" in PM, is that really any of your fucking business to jump in and judge and call them ""ridiculous""?If that post offends your narcissistic sensibilities for some reason, would it be better to respond politely, or better yet, not at all? Because ""procurement"" is beneath you?r/tea...self-righteous, bootlicking tea snobs?",Here's some better questions...
1161,tea,"Hello, I am in the market for a loose-leaf Oolong tea. Are there any companies you recommend that I try? Thank you",Oolong recommendations
1162,tea,"Sorry to be blunt about it, I'm frustrated that my last 2 orders from S. A. got yanked by customs, It's the only safe effective alleviation for my depression. It's a goddamn travesty this perfectly safe natural plant is restricted, we're supposed to have god-given liberties and self-determination in the US, now being trampled by bureaucrats and bloated govt agencies.Anyhow, any help finding coca novo tea flour, plz message me--sorry if this post breaks the rules.",Where to get E. coca/novo tea flour in US
1163,tea,,"Good tip, definitely going to try this."
1164,tea,,In Pursuit of Tea: White Peony Bai Mudan.
1165,tea,,What is slit on the box meant for? Its too small to pull out a tea bag so it can’t be for that
1166,tea,,Everything You Wonder About Turkish Tea
1167,tea,"Most teas I know do best when brewed at sub-boiling temperatures, was wondering if there’s any that shine the most at boiling temperatures.",What tea does best when boiled or brewed with boiling water?
1168,tea,,had a lovely cup of earl grey this morning with a small bit of milk. drank it nice and slow while admiring the view!
1169,tea,,"Hello, I picked these up in Japan a back in 2012. Can anyone translate what these teas are? I’ve never known."
1170,tea,"I've just opened the lost ark and I fear the treasures inside may be too much for mankind.I made my tea like normal, and then I had the idea to put it back in the kettle and use the 1st infusion to make the 2nd infusion after the leaves cooled down all the way. It turns out I made tea that was twice as sweet and aromatic without adding any bitterness or astringency. when I exhale after a sip, it's nearly as strong as smelling the cold leaves directly. I am tempted to make triple and so on tea, but I'm not sure if my body can handle that level of unbridled tea power yet",I made double power tea
1171,tea,"Hey everyone! I'm a pharmacist and a tea lover and I have always been interested in medicinal teas. Things like valerian for sleep, marshmallow root for sore throats, senna for constipation. I'm interested in putting together my own blends but if I'm going to be steeping and drinking this stuff I want to make sure it is quality with as little sketchy-ness as possible. Does anyone have a recommendation for where to buy dried herbal products like this?",Where to buy bulk medicinal herbals for tea
1172,tea,I'm looking to buy younger (2018+) Dayi/Menghai teas and can't find any vendors online that ship to the US.,Where to buy younger Dayi/Mengai pu'er online?
1173,tea,,Rubber ducky tea infuser!
1174,tea,I saw this posted on social media - is this a real thing? I could not find any information on it[,Pumpkin tea cake? Is this a real thing?
1175,tea,,"To us, Easter is not about eggs or bunnies"
1176,tea,,Arrived in the mail today
1177,tea,,First white 2 tea order. My wife and I got some when we were in China but this is my first order being back in America.
1178,tea,,It is what it is...
1179,tea,"Hi, after I got my first tea set, my partner's mom got interested in getting one for my partner's sister. She's very clumsy and breaks things easily so we are trying to find a good cast iron set so she can't break it easily. Does anyone know any good sets/tea pots or a good shop to find one?",Good cast iron tea sets/pots?
1180,tea,"To try to save money I want to make my own and experiment to see what I like aswell since i only like a very select few at the moment. So far I only like Arizona half and half, Arizona sweet tea, and pure leaf sweet tea. I have tried the pure leaf unsweetened black tea and it was ok but I wouldn't buy it if there was the sweet tea available. Thanks in advance",I want to make my own but I have no idea what brand of teabags I'll like
1181,tea,"I'm old enough and am busy enough that I don't care to mess with tea balls. I just want straight up bagged tea. All the boxes on the ""best of"" lists that I've found on the Google are all loose leaf. Has anyone found a bagged tea subscription?",Are there any subscription boxes that come with bags?
1182,tea,,"Yin Zhen I got to try at work, it was amazing I can't stop thinking about it. What's your favourite white tea?"
1183,tea,Hello. I just joined this subreddit because I wanted to rant a little bit and ask for help.  One of the things I hate the most in this world is when I get tea in a jug or can and it doesn't mention that it has lemon flavor in it.  I'm just really picky when it comes to putting lemon flavor in tea. Some brands will even have a separate sweet tea and lemon sweet tea flavor and they will both have lemon flavor in it. Does anybody have any recommendations for brands of sweet tea that do NOT have lemon flavor in them?,Canned tea pet peeve
1184,tea,,Disappointed. Where to go from here? (Description in Comments)
1185,tea,"They seem to have a small but high quality selection of Taiwanese oolongs, including some competition winners. The prices are certainly high enough. But I can’t seem to find anything about them off their site eg not on the vendor list. Wondering if anyone has bought from them and if the teas are genuine. Because frankly if I were selling crap tea I’d charge an arm and a leg for it given that people often use price as a proxy for quality.",Has anyone purchased from Mantra Tea?
1186,tea,"I’m just curious what the average amount is. i usually have 1-2 in the morning then maybe 1 later in the afternoon (if it’s raining. i love drinking tea on rainy days lol) i’m also just curious, how much tea is to much tea? Like is there a specific amount that is considered “dangerous”so in total, 2 (sometimes 3) every other day for me.",How many cups/mugs of tea would you say you have a day?
1187,tea,"Anyone know how to find these? I've searched through all the teas without luck, so not sure if I missed  the egg picture or if I have to be logged in to find it.",Adagio Tea Easter Egg Hunt 2022
1188,tea,,I want your unfiltered thoughts on Eurotium Cristatum!
1189,tea,"A family member of mine has been suffering from anxiety, and honestly I can't remember the last time he had a good sleep. People often recommend buying the brand that has the bud of the chamomile flower, but there are alot of products online with both good and bad reviews, So I wanted to get your opinion. (As I live in india, I would prefer an Indian brand)",What's the best brand for chamomile tea in India?
1190,tea,"Im pretty new to tea drinking and Idk if this type of brewing is good for this kind of tea,if thats bad thing tell menplease.Anyway, when I leave the leaves to soak for a bit and then add hotter water I find the taste actually better than without it.Anyway, I don't really know if this is correct way to brew this tea but it tastes great,If someone is curious abt it,I'd highy recommed this way:)",Pre-brewing my grape pu er with hibiscus
1192,tea,"Hi tea lovers! It's my first time posting here so pardon if I make any mistakes in my post... I was interested in trying Lapsang Souchong and am going to buy some from a local teashop.. however, on the tea shop's description for the tea, it says it's preferrable to use the Gong Fu Cha style but I need a Gaiwan/Yixing teapot as well as a little pitcher (basically a Gong Fu tea set). Anybody know if I can get away with brewing it in any other way for now sans Gong Fu set, without compromising it's flavor/quality? (aside to being new to this sub, I'm also fairly new to the tea game, pardon my ignorance!)",How to brew Lapsang Souchong without a Gaiwan tea set?
1193,tea,"Dear Fellow Tea Consumers!  My gong dao bei happend to be cracked. I wonder if it's able to be saved? With some food grade superglue maybe? (If it's even exists). Maybe somehow reinforce it, with some epoxy or something?  It's a part of a neat little kit I want to save it if possible.  Thank you for the suggestions!",Can I saved a cracked glass?
1195,tea,I’d tried camomile with honey and vanilla before (as a premade tea) and really didn’t like it and thought it’d might’ve been the added honey and vanilla so today I bought pure camomile tea and I really like it!,Just tried pure Camomile tea
1196,tea,,got a new kettle and these marks appeared at the bottom after boiling water once what is this?
1197,tea,Is all day in the full tropical sun going to be destructive to the flavor?,Is it possible to sun dry black tea too aggressively?
1198,tea,I'm an avid coffee drinker and want to venture into the tea world. What are some good teas to start with? I'm not affairs to try new things and my pallet is very fluid.,Recommendations
1199,tea,,In Pursuit of Tea: Shan Lin Xi Roasted Rolled Oolong.
1200,tea,Are there any tisanes (caffeine free) that help to wake you up and give you a lil pep in your step 🤣 or improve your mood?! I would love some recommendations! Thank you! ☺️,What is the best tea to boost your mood?
1201,tea,"I've been trying to make bubble tea for awhile now, and every time I try, the tapioca pearls are soft while cooking, but by the time I drink them, they become hard.I'm using a pre-made pack of tapioca pearls and following the instructions -5 min boil-5 min rest -cold water bathThen mixed with honey and brown sugar syrup for 5 or so minutes, and the balls still harden by the end. Any tips on what to do? Should I make them from scratch instead?",Bubble tea tapioca pearls hardening: help
1202,tea,,"Lavender Tea by Buddha Teas. Such a subtle, smooth and nutty tea! This is great with honey."
1203,tea,"Usually I just stick to basic tea bags with sugar (and milk with black tea), but if anyone has any interesting recommendations that go beyond this then let me know!","I made my own London Fog at home and loved it! If anyone has any other recommendations for me to try making, let me know :)"
1204,tea,My dad is outwardly judging me at a restaurant for ordering hot tea when it’s 70 degrees Fahrenheit. Am I in the wrong for this? Or am I being gaslighted?,I need a second opinion
1205,tea,"I'm brand new to loose leaf tea brewing and I'm currently using an infusing mug to brew my tea but would prefer something more traditional (tea pot, cups, I suppose what would be considered a full tea set). Does anyone have any recommendations for a quality set that won't break the bank?",New To Tea
1206,tea,,"First time trying some good tea beyond packets and herbal Greek mountain tea. Absolutely delicious, completely in love."
1207,tea,"If the average amount of liquid is 90-110ml per brew, *how* can you steep a tea 5+ times without making yourself sick from drinking this amount of liquid? I don’t understand how people gong fu their tea regularly.",How do you guys manage to brew tea gong fu style without water logging yourself?
1209,tea,,how long do y’all brew pu-er in a gaiwan? the internet is giving me such mixed results
1210,tea,"Hello, I currently like one specific tea and I would like some recommendations for tea if possibleI dont know how to flair this",Anyone got some Tea recommendations?
1211,tea,,This tea was gifted to me a VERY long time ago. Anyone know what it is and if it's still good?
1212,tea,,this is the best feeling
